<?xml version="1.0" encoding="UTF-8"?>
<!DOCTYPE rando SYSTEM "format.dtd">
<rando>
  <nom>Trek du Col des Gentianes</nom>
  <etape>
    <heureDepart>H13M30</heureDepart>
    <ravitaillement>0</ravitaillement>
    <dejeuner>R</dejeuner>
    <midi>
      <lieu>0</lieu>
      <repas>R</repas>
    </midi>
    <soir>R</soir>
    <nuit>R</nuit>
    <point>
      <toponyme>Parking de la Raillere</toponyme>
      <pk>0.0</pk>
      <altitude>1042</altitude>
      <pause>H0M0</pause>
    </point>
    <point>
      <toponyme>Pont_de_Benques</toponyme>
      <pk>0.3</pk>
      <altitude>1050</altitude>
      <pause>H0M0</pause>
    </point>
    <point>
      <toponyme>Passerelle_du_Lutour</toponyme>
      <pk>0.6</pk>
      <altitude>1110</altitude>
      <pause>H0M5</pause>
    </point>
    <point>
      <toponyme>Intersection_GR10</toponyme>
      <pk>1.1</pk>
      <altitude>1200</altitude>
      <pause>H0M0</pause>
    </point>
    <point>
      <toponyme>Le_Pradet</toponyme>
      <pk>1.6</pk>
      <altitude>1260</altitude>
      <pause>H0M0</pause>
    </point>
    <point>
      <toponyme>Passerelle_d'Artigue</toponyme>
      <pk>2.2</pk>
      <altitude>1309</altitude>
      <pause>H0M0</pause>
    </point>
    <point>
      <toponyme>La_Fruitiere</toponyme>
      <pk>3.6</pk>
      <altitude>1371</altitude>
      <pause>H0M0</pause>
    </point>
  </etape>
  <etape>
    <heureDepart>H9M30</heureDepart>
    <ravitaillement>0</ravitaillement>
    <dejeuner>R</dejeuner>
    <midi>
      <lieu>2</lieu>
      <repas>R</repas>
    </midi>
    <soir>B</soir>
    <nuit>B</nuit>
    <point>
      <toponyme>La Fruitiere</toponyme>
      <pk>0.0</pk>
      <altitude>1371</altitude>
      <pause>H0M0</pause>
    </point>
    <point>
      <toponyme>Refuge_d'Estom</toponyme>
      <pk>5.6</pk>
      <altitude>1804</altitude>
      <pause>H1M0</pause>
    </point>
    <point>
      <toponyme>Epaule_du_Labas</toponyme>
      <pk>8.4</pk>
      <altitude>2210</altitude>
      <pause>H0M0</pause>
    </point>
    <point>
      <toponyme>Lac_d'Estom-Soubiran</toponyme>
      <pk>9.9</pk>
      <altitude>2360</altitude>
      <pause>H0M0</pause>
    </point>
    <point>
      <toponyme>Lac_Couy</toponyme>
      <pk>10.4</pk>
      <altitude>2445</altitude>
      <pause>H0M10</pause>
    </point>
    <point>
      <toponyme>Lac_Glace</toponyme>
      <pk>11.4</pk>
      <altitude>2565</altitude>
      <pause>H0M0</pause>
    </point>
    <point>
      <toponyme>Col_des_Gentianes</toponyme>
      <pk>12.5</pk>
      <altitude>2729</altitude>
      <pause>H0M0</pause>
    </point>
  </etape>
  <etape>
    <heureDepart>H9M30</heureDepart>
    <ravitaillement>0</ravitaillement>
    <dejeuner>B</dejeuner>
    <midi>
      <lieu>3</lieu>
      <repas>B</repas>
    </midi>
    <soir>R</soir>
    <nuit>R</nuit>
    <point>
      <toponyme>Col des Gentianes</toponyme>
      <pk>0.0</pk>
      <altitude>2729</altitude>
      <pause>H0M0</pause>
    </point>
    <point>
      <toponyme>Vallee_des_Oulettes</toponyme>
      <pk>1.9</pk>
      <altitude>2285</altitude>
      <pause>H0M10</pause>
    </point>
    <point>
      <toponyme>Refuge_de_Bayssellance</toponyme>
      <pk>3.7</pk>
      <altitude>2651</altitude>
      <pause>H1M30</pause>
    </point>
    <point>
      <toponyme>Hourquette_d'Ossoue</toponyme>
      <pk>4.5</pk>
      <altitude>2734</altitude>
      <pause>H0M10</pause>
    </point>
    <point>
      <toponyme>Refuge_des_Oulettes</toponyme>
      <pk>8.2</pk>
      <altitude>2151</altitude>
      <pause>H0M0</pause>
    </point>
  </etape>
  <etape>
    <heureDepart>H8M30</heureDepart>
    <ravitaillement>0</ravitaillement>
    <dejeuner>R</dejeuner>
    <midi>
      <lieu>6</lieu>
      <repas>R</repas>
    </midi>
    <soir>R</soir>
    <nuit>R</nuit>
    <point>
      <toponyme>Refuge des Oulettes</toponyme>
      <pk>0.0</pk>
      <altitude>2151</altitude>
      <pause>H0M0</pause>
    </point>
    <point>
      <toponyme>Passerelle</toponyme>
      <pk>2.2</pk>
      <altitude>1980</altitude>
      <pause>H0M0</pause>
    </point>
    <point>
      <toponyme>Cabane_du_Pinet</toponyme>
      <pk>4.1</pk>
      <altitude>1780</altitude>
      <pause>H0M0</pause>
    </point>
    <point>
      <toponyme>Lac_de_Gaube</toponyme>
      <pk>4.7</pk>
      <altitude>1725</altitude>
      <pause>H0M0</pause>
    </point>
    <point>
      <toponyme>Passerelle_de_Gaube</toponyme>
      <pk>5.6</pk>
      <altitude>1725</altitude>
      <pause>H0M30</pause>
    </point>
    <point>
      <toponyme>Pont_d'Espagne</toponyme>
      <pk>7.7</pk>
      <altitude>1496</altitude>
      <pause>H0M10</pause>
    </point>
    <point>
      <toponyme>Pont_de_Bousses</toponyme>
      <pk>9.3</pk>
      <altitude>1380</altitude>
      <pause>H0M0</pause>
    </point>
    <point>
      <toponyme>Pont_du_Ceriset</toponyme>
      <pk>10.2</pk>
      <altitude>1263</altitude>
      <pause>H0M0</pause>
    </point>
    <point>
      <toponyme>La_Raillere</toponyme>
      <pk>12.2</pk>
      <altitude>1042</altitude>
      <pause>H0M0</pause>
    </point>
  </etape>
</rando>
