<?xml version="1.0" encoding="UTF-8"?>
<!DOCTYPE rando SYSTEM "format.dtd">
<rando>
  <nom>Tour_de_la_Jordanne</nom>
  <etape>
    <heureDepart>H9M0</heureDepart>
    <ravitaillement>0</ravitaillement>
    <dejeuner>R</dejeuner>
    <midi>
      <lieu>9</lieu>
      <repas>B</repas>
    </midi>
    <soir>B</soir>
    <nuit>B</nuit>
    <point>
      <toponyme>Mandailles</toponyme>
      <pk>0.0</pk>
      <altitude>924</altitude>
      <pause>H0M0</pause>
    </point>
    <point>
      <toponyme>Le_Mas</toponyme>
      <pk>0.3</pk>
      <altitude>933</altitude>
      <pause>H0M0</pause>
    </point>
    <point>
      <toponyme>Reservoir</toponyme>
      <pk>1.5</pk>
      <altitude>1105</altitude>
      <pause>H0M0</pause>
    </point>
    <point>
      <toponyme>D317</toponyme>
      <pk>2.6</pk>
      <altitude>1220</altitude>
      <pause>H0M0</pause>
    </point>
    <point>
      <toponyme>Arete_du_Pertus</toponyme>
      <pk>4.0</pk>
      <altitude>1330</altitude>
      <pause>H0M0</pause>
    </point>
    <point>
      <toponyme>Col_de_Ragouze</toponyme>
      <pk>5.0</pk>
      <altitude>1343</altitude>
      <pause>H0M0</pause>
    </point>
    <point>
      <toponyme>Col_du_Gliziou</toponyme>
      <pk>6.2</pk>
      <altitude>1365</altitude>
      <pause>H0M0</pause>
    </point>
    <point>
      <toponyme>Col_du_Griou</toponyme>
      <pk>8.8</pk>
      <altitude>1579</altitude>
      <pause>H0M0</pause>
    </point>
    <point>
      <toponyme>Puy_Griou</toponyme>
      <pk>9.1</pk>
      <altitude>1690</altitude>
      <pause>H0M0</pause>
    </point>
    <point>
      <toponyme>Col_du_Griou</toponyme>
      <pk>9.4</pk>
      <altitude>1579</altitude>
      <pause>H0M0</pause>
    </point>
    <point>
      <toponyme>Col_de_Rombiere</toponyme>
      <pk>10.7</pk>
      <altitude>1525</altitude>
      <pause>H0M0</pause>
    </point>
    <point>
      <toponyme>Col_de_Cabre</toponyme>
      <pk>12.1</pk>
      <altitude>1528</altitude>
      <pause>H0M0</pause>
    </point>
    <point>
      <toponyme>Puy_de_Peyre_Arse</toponyme>
      <pk>13.2</pk>
      <altitude>1806</altitude>
      <pause>H0M0</pause>
    </point>
  </etape>
  <etape>
    <heureDepart>H7M0</heureDepart>
    <ravitaillement>0</ravitaillement>
    <dejeuner>B</dejeuner>
    <midi>
      <lieu>6</lieu>
      <repas>R</repas>
    </midi>
    <soir>R</soir>
    <nuit>R</nuit>
    <point>
      <toponyme>Puy de Peyre Arse</toponyme>
      <pk>0.0</pk>
      <altitude>1806</altitude>
      <pause>H0M0</pause>
    </point>
    <point>
      <toponyme>GR400</toponyme>
      <pk>1.2</pk>
      <altitude>1652</altitude>
      <pause>H0M0</pause>
    </point>
    <point>
      <toponyme>Fours_de_Peyre_Arse</toponyme>
      <pk>1.8</pk>
      <altitude>1677</altitude>
      <pause>H0M0</pause>
    </point>
    <point>
      <toponyme>Breche_de_Rolland</toponyme>
      <pk>2.3</pk>
      <altitude>1647</altitude>
      <pause>H0M0</pause>
    </point>
    <point>
      <toponyme>Puy_Mary</toponyme>
      <pk>3.3</pk>
      <altitude>1783</altitude>
      <pause>H0M0</pause>
    </point>
    <point>
      <toponyme>Pas_de_Peyrol</toponyme>
      <pk>4.0</pk>
      <altitude>1588</altitude>
      <pause>H0M0</pause>
    </point>
    <point>
      <toponyme>Col_de_Roche_Noire</toponyme>
      <pk>5.7</pk>
      <altitude>1531</altitude>
      <pause>H0M0</pause>
    </point>
    <point>
      <toponyme>Col_de_Redondet</toponyme>
      <pk>6.4</pk>
      <altitude>1640</altitude>
      <pause>H0M0</pause>
    </point>
    <point>
      <toponyme>Puy_Chavaroche</toponyme>
      <pk>7.4</pk>
      <altitude>1739</altitude>
      <pause>H0M0</pause>
    </point>
    <point>
      <toponyme>Col_du_Piquet</toponyme>
      <pk>8.7</pk>
      <altitude>1541</altitude>
      <pause>H0M0</pause>
    </point>
    <point>
      <toponyme>La_Fumade_Vieille</toponyme>
      <pk>10.0</pk>
      <altitude>1173</altitude>
      <pause>H0M0</pause>
    </point>
    <point>
      <toponyme>Lasteyrie</toponyme>
      <pk>11.0</pk>
      <altitude>989</altitude>
      <pause>H0M0</pause>
    </point>
    <point>
      <toponyme>Mandailles</toponyme>
      <pk>11.6</pk>
      <altitude>924</altitude>
      <pause>H0M0</pause>
    </point>
  </etape>
</rando>
