<?xml version="1.0" encoding="UTF-8"?>
<!DOCTYPE rando SYSTEM "format.dtd">
<rando>
  <nom>Boucle de Berniquaut</nom>
  <etape>
    <heureDepart>H8M0</heureDepart>
    <ravitaillement>0</ravitaillement>
    <dejeuner>R</dejeuner>
    <midi>
      <lieu>13</lieu>
      <repas>B</repas>
    </midi>
    <soir>B</soir>
    <nuit>R</nuit>
    <point>
      <toponyme>Sorreze</toponyme>
      <pk>0.0</pk>
      <altitude>267</altitude>
      <pause>H0M0</pause>
    </point>
    <point>
      <toponyme>Cimetiere</toponyme>
      <pk>0.9</pk>
      <altitude>284</altitude>
      <pause>H0M0</pause>
    </point>
    <point>
      <toponyme>Roc_de_la_Fendeille</toponyme>
      <pk>2.7</pk>
      <altitude>542</altitude>
      <pause>H0M10</pause>
    </point>
    <point>
      <toponyme>Cote_537m</toponyme>
      <pk>3.5</pk>
      <altitude>537</altitude>
      <pause>H0M0</pause>
    </point>
    <point>
      <toponyme>Aven_de_Polypheme</toponyme>
      <pk>4.2</pk>
      <altitude>490</altitude>
      <pause>H0M0</pause>
    </point>
    <point>
      <toponyme>Grotte_du_Calel</toponyme>
      <pk>4.6</pk>
      <altitude>525</altitude>
      <pause>H0M5</pause>
    </point>
    <point>
      <toponyme>Carriere</toponyme>
      <pk>5.3</pk>
      <altitude>540</altitude>
      <pause>H0M0</pause>
    </point>
    <point>
      <toponyme>Intersection</toponyme>
      <pk>5.6</pk>
      <altitude>515</altitude>
      <pause>H0M0</pause>
    </point>
    <point>
      <toponyme>Pistre</toponyme>
      <pk>5.8</pk>
      <altitude>558</altitude>
      <pause>H0M0</pause>
    </point>
    <point>
      <toponyme>Le_Castelet</toponyme>
      <pk>6.6</pk>
      <altitude>635</altitude>
      <pause>H0M5</pause>
    </point>
    <point>
      <toponyme>Relais_de_Trinquebise</toponyme>
      <pk>7.1</pk>
      <altitude>680</altitude>
      <pause>H0M0</pause>
    </point>
    <point>
      <toponyme>Ruisseau_d'Orival</toponyme>
      <pk>7.6</pk>
      <altitude>660</altitude>
      <pause>H0M0</pause>
    </point>
    <point>
      <toponyme>Chapelle_de_Saint-Jammes</toponyme>
      <pk>8.0</pk>
      <altitude>690</altitude>
      <pause>H1M0</pause>
    </point>
    <point>
      <toponyme>Cote_689m</toponyme>
      <pk>8.6</pk>
      <altitude>689</altitude>
      <pause>H0M0</pause>
    </point>
    <point>
      <toponyme>Cote_688m</toponyme>
      <pk>8.9</pk>
      <altitude>688</altitude>
      <pause>H0M0</pause>
    </point>
    <point>
      <toponyme>Cote_672m</toponyme>
      <pk>9.7</pk>
      <altitude>672</altitude>
      <pause>H0M0</pause>
    </point>
    <point>
      <toponyme>Le_Montagnet</toponyme>
      <pk>11.0</pk>
      <altitude>690</altitude>
      <pause>H0M5</pause>
    </point>
    <point>
      <toponyme>jacournassy</toponyme>
      <pk>11.6</pk>
      <altitude>645</altitude>
      <pause>H0M0</pause>
    </point>
    <point>
      <toponyme>Peyra_Ficada</toponyme>
      <pk>13.2</pk>
      <altitude>550</altitude>
      <pause>H0M0</pause>
    </point>
    <point>
      <toponyme>Col</toponyme>
      <pk>13.6</pk>
      <altitude>545</altitude>
      <pause>H0M0</pause>
    </point>
    <point>
      <toponyme>Oppidum_de_Berniquaut</toponyme>
      <pk>14.0</pk>
      <altitude>568</altitude>
      <pause>H1M0</pause>
    </point>
    <point>
      <toponyme>Cote_395m</toponyme>
      <pk>15.5</pk>
      <altitude>395</altitude>
      <pause>H0M0</pause>
    </point>
    <point>
      <toponyme>Saint_Alby</toponyme>
      <pk>16.5</pk>
      <altitude>292</altitude>
      <pause>H0M0</pause>
    </point>
    <point>
      <toponyme>Sorreze</toponyme>
      <pk>17.1</pk>
      <altitude>267</altitude>
      <pause>H0M0</pause>
    </point>
  </etape>
</rando>
