<?xml version="1.0" encoding="UTF-8"?>
<!DOCTYPE rando SYSTEM "format.dtd">
<rando>
  <nom>Tour_du_Caroux</nom>
  <etape>
    <heureDepart>H8M0</heureDepart>
    <ravitaillement>0</ravitaillement>
    <dejeuner>R</dejeuner>
    <midi>
      <lieu>9</lieu>
      <repas>B</repas>
    </midi>
    <soir>B</soir>
    <nuit>B</nuit>
    <point>
      <toponyme>Pont_d'HÃ©ric</toponyme>
      <pk>0.0</pk>
      <altitude>154</altitude>
      <pause>H0M0</pause>
    </point>
    <point>
      <toponyme>Pont_ferroviaire</toponyme>
      <pk>0.9</pk>
      <altitude>160</altitude>
      <pause>H0M0</pause>
    </point>
    <point>
      <toponyme>Le_Verdier_Haut</toponyme>
      <pk>1.3</pk>
      <altitude>200</altitude>
      <pause>H0M0</pause>
    </point>
    <point>
      <toponyme>Pont_du_Rieu-Tort</toponyme>
      <pk>2.5</pk>
      <altitude>290</altitude>
      <pause>H0M0</pause>
    </point>
    <point>
      <toponyme>Pont_du_Cerisier</toponyme>
      <pk>3.4</pk>
      <altitude>329</altitude>
      <pause>H0M0</pause>
    </point>
    <point>
      <toponyme>Heric</toponyme>
      <pk>5.9</pk>
      <altitude>511</altitude>
      <pause>H0M10</pause>
    </point>
    <point>
      <toponyme>Antecime</toponyme>
      <pk>6.2</pk>
      <altitude>580</altitude>
      <pause>H0M0</pause>
    </point>
    <point>
      <toponyme>Col_du_Salis</toponyme>
      <pk>8.4</pk>
      <altitude>754</altitude>
      <pause>H0M0</pause>
    </point>
    <point>
      <toponyme>Col_de_Liousses</toponyme>
      <pk>9.8</pk>
      <altitude>931</altitude>
      <pause>H1M0</pause>
    </point>
    <point>
      <toponyme>Col_de_l'Airole</toponyme>
      <pk>10.5</pk>
      <altitude>946</altitude>
      <pause>H0M0</pause>
    </point>
    <point>
      <toponyme>Douch</toponyme>
      <pk>10.9</pk>
      <altitude>897</altitude>
      <pause>H0M5</pause>
    </point>
    <point>
      <toponyme>Cote_918m</toponyme>
      <pk>11.4</pk>
      <altitude>918</altitude>
      <pause>H0M0</pause>
    </point>
    <point>
      <toponyme>Cote_1036m</toponyme>
      <pk>12.7</pk>
      <altitude>1036</altitude>
      <pause>H0M0</pause>
    </point>
    <point>
      <toponyme>Col_d'Alingri</toponyme>
      <pk>13.1</pk>
      <altitude>1063</altitude>
      <pause>H0M0</pause>
    </point>
    <point>
      <toponyme>Tour_du_Caroux</toponyme>
      <pk>13.5</pk>
      <altitude>1091</altitude>
      <pause>H0M30</pause>
    </point>
    <point>
      <toponyme>Col_d'Alingri</toponyme>
      <pk>13.9</pk>
      <altitude>1063</altitude>
      <pause>H0M0</pause>
    </point>
    <point>
      <toponyme>Intersection_GR7</toponyme>
      <pk>14.8</pk>
      <altitude>1055</altitude>
      <pause>H0M0</pause>
    </point>
    <point>
      <toponyme>Rieu_Tort</toponyme>
      <pk>16.2</pk>
      <altitude>970</altitude>
      <pause>H0M0</pause>
    </point>
    <point>
      <toponyme>Plo_de_la_Maurelle</toponyme>
      <pk>16.6</pk>
      <altitude>1055</altitude>
      <pause>H0M0</pause>
    </point>
    <point>
      <toponyme>Refuge_de_Font_Salesse</toponyme>
      <pk>16.9</pk>
      <altitude>1045</altitude>
      <pause>H0M0</pause>
    </point>
  </etape>
  <etape>
    <heureDepart>H7M0</heureDepart>
    <ravitaillement>0</ravitaillement>
    <dejeuner>B</dejeuner>
    <midi>
      <lieu>17</lieu>
      <repas>B</repas>
    </midi>
    <soir>R</soir>
    <nuit>R</nuit>
    <point>
      <toponyme>Refuge_de_Font_Salesse</toponyme>
      <pk>0.0</pk>
      <altitude>1045</altitude>
      <pause>H0M0</pause>
    </point>
    <point>
      <toponyme>Table_d'orientation</toponyme>
      <pk>0.8</pk>
      <altitude>1037</altitude>
      <pause>H0M10</pause>
    </point>
    <point>
      <toponyme>Intersection_1062m</toponyme>
      <pk>1.4</pk>
      <altitude>1062</altitude>
      <pause>H0M0</pause>
    </point>
    <point>
      <toponyme>Plo_de_l'Aygue</toponyme>
      <pk>1.9</pk>
      <altitude>1056</altitude>
      <pause>H0M0</pause>
    </point>
    <point>
      <toponyme>Jasse_de_Joucla</toponyme>
      <pk>2.5</pk>
      <altitude>1050</altitude>
      <pause>H0M0</pause>
    </point>
    <point>
      <toponyme>Intersection_1047m</toponyme>
      <pk>3.3</pk>
      <altitude>1047</altitude>
      <pause>H0M0</pause>
    </point>
    <point>
      <toponyme>Cote_1033m</toponyme>
      <pk>3.8</pk>
      <altitude>1033</altitude>
      <pause>H0M0</pause>
    </point>
    <point>
      <toponyme>Bel_Plo</toponyme>
      <pk>4.6</pk>
      <altitude>980</altitude>
      <pause>H0M0</pause>
    </point>
    <point>
      <toponyme>Intersection</toponyme>
      <pk>4.8</pk>
      <altitude>955</altitude>
      <pause>H0M0</pause>
    </point>
    <point>
      <toponyme>Ruisseau_de_la_Combe</toponyme>
      <pk>5.6</pk>
      <altitude>1000</altitude>
      <pause>H0M0</pause>
    </point>
    <point>
      <toponyme>Intersection_996m</toponyme>
      <pk>6.2</pk>
      <altitude>996</altitude>
      <pause>H0M10</pause>
    </point>
    <point>
      <toponyme>Intersection_595m</toponyme>
      <pk>7.6</pk>
      <altitude>595</altitude>
      <pause>H0M0</pause>
    </point>
    <point>
      <toponyme>Col_de_la_Pomarede</toponyme>
      <pk>8.1</pk>
      <altitude>503</altitude>
      <pause>H0M0</pause>
    </point>
    <point>
      <toponyme>Reservoir</toponyme>
      <pk>9.3</pk>
      <altitude>320</altitude>
      <pause>H0M0</pause>
    </point>
    <point>
      <toponyme>Stele</toponyme>
      <pk>10.0</pk>
      <altitude>232</altitude>
      <pause>H0M0</pause>
    </point>
    <point>
      <toponyme>La_Coste</toponyme>
      <pk>10.6</pk>
      <altitude>235</altitude>
      <pause>H0M0</pause>
    </point>
    <point>
      <toponyme>Pont_d'Heric</toponyme>
      <pk>12.0</pk>
      <altitude>154</altitude>
      <pause>H0M0</pause>
    </point>
  </etape>
</rando>
